uuid,professional_persona,sports_persona,arts_persona,travel_persona,culinary_persona,persona,cultural_background,skills_and_expertise,skills_and_expertise_list,hobbies_and_interests,hobbies_and_interests_list,career_goals_and_ambitions,sex,age,marital_status,education_level,occupation,region,area,prefecture,country,age_band,household_income_bracket,household_income_midpoint_manyen,household_income_source,income_tier,disposable_income_feel,price_sensitivity,brand_orientation,promotion_responsiveness,bulk_buy_tendency,ec_adoption,primary_purchase_channels,media_contact,backstory_250w
f843898ec73148a5ae8320167f340c1f,比嘉 博士はデジタルツールを駆使して自動車整備工場の業務効率を最大化するマネジメント戦略を推進している。彼らは在庫管理システムと診断ソフトを統合し、作業時間とコストの削減を可視化するダッシュボードでチームの進捗をリアルタイムに共有し、約束した納期は必ず守るという誠実性を実務に落とし込んでいる。,比嘉 博士は地域祭りで鼓手のリズムに合わせた体力トレーニングや、車両撮影時のロケーション移動を活かしたサイクリングを楽しむアクティブライフを送っている。彼らは週末に自転車で河川敷を走り、魅力的な風景構図を追求しながらカロリー消費と心理的リフレッシュを同時に実現し、外向性と協調性をスポーツに統合している。,比嘉 博士は車両の光と影を捉えるフォトグラフィーで、祭りの提灯や邦服とのコラボ作品を制作し、非伝統的な美意識を表現している。彼らはミラーレンズと低感度ISO設定で夜間の色彩再現を追求し、作品展示の際には観客に対話的な解釈を促す開放的な芸術体験を提供し、創造的思考と社交的発信力を融合させている。,比嘉 博士はロードトリップを活用し、毎年名古屋市の青祭りと長野県の雪まつりの二大祭典を巡り、地域の祭礼と風土に根ざした体験を重ねている。彼らは車の走行距離を測定し、エンジン音と自然音の対比を楽しみながら、宿泊先で開催される地元料理の試食と、次回の旅程をデジタルカレンダーで共創し、リーダーシップと拡張性のある旅行計画を実践している。,比嘉 博士は地元の味噌カツと祭りで提供されるたこ焼きの食感と塩分バランスを評価し、整備作業の合間に自作のスパイスミックスでバーベキューソースを調合している。彼らは部品交換の時短手順を催し料理のフレーバー実験に置き換え、味覚の微調整と効率化への講義を自身のツールキットに具現化し、流行と伝統の対話を食卓に持ち込んでいる。,比嘉 博士は費用対効果と創造性を同時に追求する、地域密着型自動車整備の未来設計師である。,愛知県の中部地方で育ち、地元の祭りや地域コミュニティ活動に参加する機会が多く、周囲との協調や費用対効果を重視する消費姿勢が自然に身についた。,マニュアル整備に加えて、車両診断ソフトや在庫管理システムを活用したデジタル整備、コストパフォーマンスを考慮した部品選定と顧客提案が得意。,"['車両診断ソフト運用', '在庫管理システム活用', '部品コストパフォーマンス分析', 'メカニカル整備', '顧客提案コミュニケーション']",地域の祭りへの参加や車両フォトグラフィー、コストを意識したDIY整備、デジタルガジェットの比較検証が好き。,"['祭り・コミュニティ参加', '車両フォトグラフィー', 'DIY整備', 'デジタルガジェット比較', 'コストパフォーマンス志向のショッピング']",デジタルツールを駆使した効率的な自動車整備工場のマネジメントに昇進し、最終的には自らのブランドで地域に根ざしたサービスを展開したい。,男,26,未婚,大学卒 文系,自動車整備業 中小,中部地方,東日本,愛知県,日本,20代以下,１００～１５０万円未満,125.0,国民生活基礎調査(0003131978)P(所得|年代)×全国家計構造調査(0003426512)県別所得指数 で年代×地域条件付け,low,切り詰め,中,NB・品質志向,中,しない,高,EC・コンビニ・ドラッグストア中心,SNS・動画中心(ネット>テレビ),愛知で自動車整備の仕事をしている。収入は少なく、一人暮らしがようやくというくらいだ。食料品と日用品はコンビニとドラッグストアと通販で済ませる。ブランドへのこだわりは薄そうに見えて、整備に使う工具だけは品質で選ぶ。安物を使って現場でトラブルが起きる方が高くつくとわかっているからだ。ガジェットも数字で比べてから決める。SNSで製品のレビューを調べるのは得意で、納得してから買う。地域の祭りには毎年顔を出す。整備した車両を写真に残すことが、仕事と趣味の境目になっている。
d322b7c8f07c4d188cca37cd768ab539,長井 謙介は、飲食サービスの現場でメニュー開発とスタッフ教育に注力し、POSとExcelを駆使したデータ分析で業務効率を高める実務志向のリーダーであり、構造的思考と高い誠実性を生かして中小カフェ開業を目指す。,長井 謙介は、近郊の川での釣りをリラクゼーションと微細な技術訓練として位置付け、外向性と計画性を活かし、季節ごとの釣果を記録しながら自己成長を図っている。,長井 謙介は、書道で心を整え、木工で実用品を制作することで高い開放性と協調性を表現し、地域の祭りで作品を披露しながら文化的価値の継承に貢献している。,長井 謙介は、箱根や伊勢への短期旅行を通じて自然と歴史に触れ、計画的な旅程と好奇心旺盛な開放性で地域の伝統行事を体験し、帰還後は職場やコミュニティに新たな視点を持ち込む。,長井 謙介は、季節の地元食材でメニューを開発し、旬の魚介類や山菜を活かした料理を提供することで、調理スキルと顧客満足への誠実性を結びつけ、スタッフと共有する実務的な料理指導を行っている。,長井 謙介は、構造的思考と地域志向を基盤に、飲食サービスの実務改革と文化的活動を融合させ、協調性と誠実性で持続可能なカフェ開業を目指す。,神奈川郡で育ち、関東地方特有の住宅街と商店街の結びつきを実感しながら、地域住民へのホスピタリティを大切にする暮らしを経験。家族や同僚との関係性から、協力と相手への気配りが自然に身についた背景。,飲食サービスの現場でメニュー開発やスタッフ教育に従事し、顧客満足度向上のためのサービス精神を発揮。POS操作や在庫管理、簡易的なExcelによる売上・材料仕入れ分析を日常的に活用し、実務上の課題に即した実務的解決策を提供。,"['メニュー開発', 'スタッフ教育', 'POS操作', '在庫管理', 'Excel活用']",休日は近郊の川で釣りを楽しむと共に、祭りや地域イベントへ積極的に参加。書道で心を整え、木工で実用品を手作りし、時折箱根や伊勢へ旅行して自然と歴史に触れることに関心を持つ。,"['釣り', '祭り参加', '書道', '木工', '旅行']",中小飲食サービスの現場経験を活かし、将来的に自らのコンセプトで小規模なカフェを開業。地域コミュニティと連携したサービス向上を推進し、後進の指導や業界団体でのリーダーシップを通じて、サービス品質の標準化を目指す。,男,45,既婚,短大卒,飲食サービス業 中小,関東地方,東日本,神奈川県,日本,40代,７００～７５０万円未満,725.0,国民生活基礎調査(0003131978)P(所得|年代)×全国家計構造調査(0003426512)県別所得指数 で年代×地域条件付け,high,切り詰め,中,PB-NB併用,低,たまに,高,スーパー・ドラッグストア・EC併用(駅前),ネット・テレビ併用,神奈川で飲食の仕事に携わって二十年近くになる。短大を出てすぐ飲食に入ったから、体でこの業界を覚えた。妻との二人暮らしで、家計はいつも余裕が見えない感じがある。スーパーや通販を組み合わせて買い物しているが衝動買いはしない。いつか小さなカフェを開きたいという気持ちが長くあって、週末の木工はその準備に近い感覚でやっている。書道で気持ちを整え、川で釣りをする。結果より水辺にいる時間が好きだ。飲食の現場で積み上げたものを自分の場所でやってみたい、その気持ちだけはずっと変わっていない。
8146217a780a4ef0beadd611f70d2367,小島 富士恵は退職後、地域史の文書化プロジェクトを主導し、研究者への指導と自治体の文化保存顧問として構造化された手順と信頼性の高さを活かすビジネス・パーソナを体現し、外向性と誠実性が協調的な組織運営に影響を与える。,小島 富士恵は季節の変化に合わせた自然散歩と軽い体操、民謡合唱をリズム運動として取り入れ、構造的な運動計画と社交性が継続的な体力維持に貢献し、彼らは地域コミュニティと調和したスポーツ・エンゲージメントを実践する。,小島 富士恵は民謡合唱と茶道、編み物を通じて伝統芸術と手仕事の融合を探求し、誠実性と開放性が創作過程の柔軟性と品質管理に影響し、彼らは季節の儀式と自然観察を芸術的表現に組み込む文化芸術の担い手である。,小島 富士恵は地域史フィールド調査と季節ごとの祭り参加を通じたローカルトラベルを好み、計画的な旅程と外向性が地域住民との交流を深め、彼らは自然と歴史への敬意が旅行体験の核になることを体現する。,小島 富士恵は郷土料理の調理と季節食材の保存、茶道の抹茶と昆布だしの技術を融合させ、協調性と神経症傾向が味のバランスと健康配慮に影響し、彼らは自然の恵みと伝統工法を食文化に落とし込む料理の探求者である。,小島 富士恵は構造化された地域保存と季節感を重んじた健康・文化・財務実践で、外向性と誠実性が調和した人生観を示す。,北海道出身で、戦後の高度成長期に大量就職ブームを体感し、地域社会の結束を重視する文化的価値観を育んだ。季節感や自然への敬意が生活の基盤にある。,実験装置のアナログ操作、手書き統計解析、紙資料の整理・保存、地域史のフィールド調査に長年従事し、デジタルツールに依存しない研究手法を熟知している。,"['アナログ実験手法','統計解析（非デジタル）','図書館資料管理','地域史調査']",散歩や編み物、郷土料理の調理、民謡の合唱、茶道など、手を使う活動と自然に触れる趣味を通じて心身の調和を保つことを好む。,"['散歩','編み物','郷土料理','民謡合唱','茶道']",退職後は後進の研究者を指導し、地域の歴史を文書化して次世代に残す活動を続けること、また自治体の文化保存プロジェクトに顧問として参画することを目指す。,女,75,既婚,高専卒,学術機関 中小 (現在は引退),北海道地方,東日本,北海道,日本,70代,５０～１００万円未満,75.0,国民生活基礎調査(0003131978)P(所得|年代)×全国家計構造調査(0003426512)県別所得指数 で年代×地域条件付け,low,切り詰め,高,NB・品質志向,低,たまに,中,スーパー・ドラッグストア・地域商店(車/家族送迎),テレビ・新聞中心(ネット利用は限定的),北海道の研究機関に長く勤めて引退してから数年が経つ。今は年金と貯蓄で夫と二人の生活を成り立たせているが、余裕はない。買い物は家族の車に乗せてもらう。スーパーとドラッグストアと地元の商店を回って、知名度のある品を優先しながら予算に合わせている。唯一妥協しないのは食材で、旬のものを地元で選ぶことに時間をかける。編み物は長く続けていて、毛糸の質と色選びを丁寧にやる。郷土料理の調理、民謡の合唱、茶道の稽古。どれも体を動かしながら人と繋がれることが好きだ。新聞とテレビで世の中の動きは十分把握している。
984c8b0fae054044a71b973a50a500a9,宮沢 湊翔は、食料品製造ラインの機械保守と工程改善のベテランとして、効率と安全の両立を追求する。オープンな好奇心で最新の自動化ソリューションを検討しつつ、綿密な標準書作成で信頼性を確保し、後進への技能伝承を使命感として掲げている。,宮沢 湊翔は、季節の川魚を狙うフライフィッシングと地域の太鼓演奏を体魄とリズムの両面で鍛える趣味を持つ。柔軟な組織感覚でチームプレイを楽しむだけでなく、競争的な側面が自己ベストを追求させ、年齢に合わせた低負荷の持続的活動を選択している。,宮沢 湊翔は、書道と盆踊りの太鼓側で、筆の一本と太鼓の叩きを通じて伝統的な美意識と自己表現を融合させている。オープンマインドで新しい筆調を試しつつ、誠実に文化行事の継承を担い、感情の起伏が作品に深みを与える。,宮沢 湊翔は、広島県内の史跡散策と川辺の釣り旅行で、歴史的背景と自然環境の調和を体感する。計画的に情報収集を行う誠実性と、未知への好奇心がバランスを取り、地域の防災祭や伝統行事に参加しながら足跡を残すことを重視している。,宮沢 湊翔は、季節の川魚の塩焼きや地元の漬物作りを通じ、食材の保存技術と風味の舌触りにこだわる。在庫ローテーションの知識で食材管理を徹底し、感情の変動が料理の味に影響をもたらす点を敏感に活かし、伝統的な食文化保存と味覚の実験を同時に行っている。,宮沢 湊翔は、機械保守と安全策で組織の信頼性を高め、在庫コスト削減と伝統行事への積極参加で地域貢献を実現する高年齢の実務者である。,広島県の中部に所在する小都市で、戦後の復興期に家族とともに生活し、地域の祈りや防災行事への参加を通じて、顕著な郷土意識と共同体への貢献感覚を育んできた。また、子育て世代の親が来訪し、同居する形で世代間交流を維持している。,食料品製造工程における機械保守とライン段取り改善の実務経験が豊富で、品質管理基礎知識と在庫ローテーション管理手法に通じている。高齢者向けの職場安全策の立案や、作業標準書の作成・更新に実績がある。,"['機械保守', 'ライン段取り改善', '品質管理基礎', '在庫ローテーション管理', '職場安全策立案', '作業標準書作成']",地域の盆踊りや祭礼の太鼓側に参加し、釣りで季節の川魚を楽しみ、歩く史跡散策で広島県を巡る歴史への意識を保ちつつ、書道を通じた精神統一や瞑想的な時間を持ち、心身のバランスを図っている。,"['盆踊り参加', '釣り', '史跡散策', '書道', '季節行事の太鼓側']",引退後は、地域産業の持続的発展を支援する形で、若手従業員への技能伝承と、地元の食文化保存活動へのボランティア参加を中心に据えている。身近な尼（兼）秘教的な改善提案や、伝統行事の運営補助を通じ、地域貢献の実感を深化させることが目標。,男,76,既婚 (子供あり),高校卒,食料品製造業 中堅 (現在は引退),中国地方,西日本,広島県,日本,70代,１５０～２００万円未満,175.0,国民生活基礎調査(0003131978)P(所得|年代)×全国家計構造調査(0003426512)県別所得指数 で年代×地域条件付け,low,普通,低,PB-NB併用,低,しない,低,スーパー・ドラッグストア・地域商店(車/家族送迎),テレビ・新聞中心(ネット利用は限定的),広島の食料品メーカーで機械保守の仕事を長くやって引退した。七十六になった今は息子が車で買い物に連れて行ってくれる。収入は多くないが、やりくりに困っているわけでもない。地域の行事への参加だけは別だ。盆踊りや祭礼の太鼓を叩くことに情熱を注いでいて、太鼓の皮と撥の手入れにかかる費用は毎年計画に入れている。川釣りも楽しんでいる。広島の史跡を歩く習慣があって、書道で気持ちを整えてから散策に出ることもある。ネットはほとんど使わない。テレビと新聞と、店で手に取って確かめる買い方が合っている。
048c22bfbf7d4a4398aac9cf5b04701f,鈴木 もえこは、地域の農産物をデジタルブランド化しオンライン販売と直売を統合した事業体を構築する過程で、開放性と協調性を活かして多様なステークホルダーと協働し、計画性を持って実行するが、事業リスクに直面した時に神経症的な不安感が顕在化できることを認識している。,鈴木 もえこは、農場での季節作業と子どもとの自然観察散歩を体力維持の主要な運動と位置付け、外向的に多人種のイベントや祭りで踊りに参加し、計画的な疲労管理を行うが、天候変化に対する不安が運動スケジュールに神経症的な調整を促す。,鈴木 もえこは、地域の音楽祭への参加と収穫風景のデジタル写真編集を芸術的表現と捉え、開放的に新しい音楽と視覚メディアを試行し、協調性で共同制作を進める一方、評価や創作の不確実性に対する心配が創作過程で神経症的エネルギーとして現れる。,鈴木 もえこは、季節ごとの祭りと郷土食体験を主軸にした旅行プランを設計し、外向的に地域住民と交流しながら計画的に移動手段と宿泊を手配し、旅行先での天候とスケジュール変更が心配の種となる神経症的傾向を持ちつつ運営する。,鈴木 もえこは、数種類の地元果実や無農薬野菜を使用した保久・発酵料理のレシピ開発と料理教室の実施を通じ、開放的に素材の可能性と料理美学を探求し、協調的に参加者の多様な嗜好に合わせ調整しながら、過剰な期待に対して心配が調理過程で神経症的に顕在化することを自覚している。,鈴木 もえこは、季節素材を活かした農業芸術とオンライン販売を統合し、外向的にコミュニティと共創しつつ、計画性と神経症的心配のバランスで事業と生活を管理する創造的リーダーである。,関東・栃木県の農村で、地域特有のくだものや野菜の保存方法が世代から受け継がれており、食文化の地域差が家庭料理に深く根付いている。子供のころは塾や習い事では音楽と農業体験教室に通い、実務と芸術への好奇心が育まれた。,有機野菜の栽培技術と土壌管理、スマート農機の操作とデータ分析による収穫予測、地域イベントの企画・運営、地元食材を活かした料理教室の指導、家族のための時間管理と育児支援。,"['有機農業', 'デジタル農業ツール活用', '地域イベント企画', '料理教室指導', '家族時間管理']",季節の食材を使った創作料理、地元の祭りや音楽イベントへの参加、子供と一緒に自然観察と絵本の読み聞かせ、簡単なデジタル写真編集で収穫風景を記録すること。,"['創作料理', '音楽イベント参加', '自然観察', 'デジタル写真編集']",自らの農場ブランドを立ち上げ、オンライン販売と地域直売を統合し、食文化の地域差を広める情報発信基地に育て上げること。将来的には農業と芸術を融合した体験型ワークショップを定期開催し、次世代の農業リーダー育成に貢献したい。,女,33,既婚 (子供あり),高校卒,農業,関東地方,東日本,栃木県,日本,30代,５５０～６００万円未満,575.0,国民生活基礎調査(0003131978)P(所得|年代)×全国家計構造調査(0003426512)県別所得指数 で年代×地域条件付け,mid,切り詰め,高,NB・品質志向,中,よくする,高,EC・ドラッグストア・郊外量販(車),SNS・動画中心(ネット>テレビ),栃木で農業をやりながら子育てと家事を抱えて動いている。夫と二人で畑を管理しているが、農業収入だけでは家計が苦しく支出を絞っている。野菜の苗だけは品質で選ぶ。安物を植えて失敗する方が損だからだ。日用品は通販と量販店を車で使い分けて安く揃える。SNSで農作業の様子を発信していて、地元の人に届いている手応えがある。子どもと一緒に自然を観察しながら歩くのが週末の楽しみで、地元の音楽イベントにも毎年参加している。楽しみに使えるお金は少なくても、農業への手応えがあるからこの暮らしを選んでいる。
