uuid,professional_persona,sports_persona,arts_persona,travel_persona,culinary_persona,persona,cultural_background,skills_and_expertise,skills_and_expertise_list,hobbies_and_interests,hobbies_and_interests_list,career_goals_and_ambitions,sex,age,marital_status,education_level,occupation,region,area,prefecture,country,age_band,household_income_bracket,household_income_midpoint_manyen,household_income_source,income_tier,disposable_income_feel,price_sensitivity,brand_orientation,promotion_responsiveness,bulk_buy_tendency,ec_adoption,primary_purchase_channels,media_contact,backstory_250w
b81ca79573b1493a86c7e8a2b1243aec,西川 碧斗は、BIMとAIを駆使したデジタル施工コンサルティングを地域の若手職人に提供し、厳格な品質基準と体系的なアーカイブ作業で建設業界の次世代技術継承に貢献している。,西川 碧斗は、雪上の軽いスノーウォーキングと自宅周辺での柔軟体操を日課とし、組織的なトレーニングログとタブレットでの進捗分析で体力維持と安全性を高めている。,西川 碧斗は、デジタルカメラで北海道の氷景を撮影し、画像編集ソフトと書道の筆致を融合させた作品で、伝統的な美意識と現代技術の共鳴を表現している。,西川 碧斗は、歴史講座で学んだ旧建築技術を現地巡礼で実体化し、冬季の雪景色と温泉宿での家族訪問を組み合わせた短期旅行で、地域文化と自然への敬意を体感している。,西川 碧斗は、季節のホタテと昆布だしで作る味噌鍋に、書道で磨いた筆の先端を使った細切り野菜を添え、食材の鮮度と調理工程の精密さで心身の調和を追求している。,西川 碧斗は、組織的なデジタル施工指導と家族への継続的支援を通じて、厳格さと柔軟な創造性を同時に具現化する高齢の技術伝承者である。,北海道出身で、寒冷地の生活慣習や自然への敬意を重んじる。家族思いで、遠くに住む子どもたちへ定期的に仕送りを行い、親世代への感謝の念も強い。,建設現場の安全管理と品質保証に長年従事し、BIMやCADを活用したデジタル施工図の作成、現場データのクラウド管理、AIを用いた作業効率分析に精通している。高齢ながらもタブレット操作や音声入力で情報入力を行うデジタルリテラシーが高い。,"['BIM','CAD','クラウド施工管理','AI作業効率分析','タブレット操作']",デジタルカメラで自然風景を撮影し、画像編集ソフトで作品を仕上げるほか、書道で心の整理を行う。地域の歴史講座に参加し、昔の建築技術と現代デジタル技術の融合を探求することに関心がある。,"['風景写真撮影','画像編集','書道','歴史講座参加','デジタル建築技術研究']",引退後は地域の若手職人や建設業界志望者にデジタル施工技術を指導し、歴代の施工手法をデジタルアーカイブ化して次世代に残すことを目指す。また、子どもたちへの仕送りを継続し、家族の安定を支えることが重要な目標。,男,85,既婚 (子供あり),短大卒,建設業 中小 (現在は引退),北海道地方,東日本,北海道,日本,80歳以上,１５０～２００万円未満,175.0,国民生活基礎調査(0003131978)P(所得|年代)×全国家計構造調査(0003426512)県別所得指数 で年代×地域条件付け,low,切り詰め,高,NB・品質志向,高,よくする,中,スーパー・ドラッグストア・地域商店(車/家族送迎),テレビ・新聞中心(ネット利用は限定的),北海道で建設の仕事をして長く生きてきた。八十五になった今は息子夫婦に車で買い物に連れて行ってもらう。体が元気でいる間は自分の目で確かめて選びたいから、ネットだけでは済ませたくない。こだわっているのは写真だ。デジタルカメラで景色を撮って編集ソフトで仕上げることに時間をかけている。建設の現場で培った空間の感覚が構図を決めるときに役立つ。書道も続けていて、地域の歴史講座で昔の建築技術が今の工法にどう続いているかを学ぶのも楽しい。大工仕事と現代技術の連続性に、自分の仕事人生の重なりを見ている。
3cc50a2385654835afe9436ee166b703,永田 眞砂子は、介護現場で培った柔軟なスケジュール調整と利用者ニーズへの臨機応変な対応力を、地域の小規模在宅支援拠点を立ち上げるビジネスプランに組み込み、彼らが持つ実務知識と開拓精神を市場競争力に変換することを目指す。,永田 眞砂子は、自然散策と季節野菜の育成を通じた軽度のハイキングと共に、彼らが静かな環境で行うストレッチや呼吸法で柔軟性と体調管理を図り、介護現場での体力維持をサポートしている。,永田 眞砂子は、邦楽や里歌の静かな聴取、短編小説や詩の読書、手作り料理のアート的プレゼンテーションを通じて、彼らが感性と実用性を同時に鍛える創造的芸術活動を日常に取り込んでいる。,永田 眞砂子は、近隣の山間部や季節ごとの農産物直売所への小旅行を、静かな道のりと自然観察を重視したスローペースで計画し、彼らが旅先で得るリラックスと地域高齢者への配慮を両立させている。,永田 眞砂子は、季節野菜の自家栽培と手作り料理のレシピ開発を通じて、味噌煮込みや山菜の和え物、彼らが地域の食材と調理技術を融合させた健康志向の食文化を発信し続けている。,永田 眞砂子は、柔軟な介護実務と季節ガーデニングで培う実用的好奇心と協調的静寂が、彼らの地域支援と自己成長を結びつける核となっている。,三重県の山間部で中学卒業まで育ち、家族や地域で努力と忍耐が美徳と教わった。結婚後は夫の勤務先に合わせて近くの町へ地方移住し、空気を読むことが日常的に求められる環境で育った。地域の多様な高齢者への配慮が当たり前の価値観として根付いている。,介護現場での体位変換や食事介助、認知症の方へのコミュニケーション技法に熟達し、紙ベースのケア記録や家族への情報共有に長けている。柔軟なスケジュール調整と、利用者のちょっとした要望にも臨機応変に対応できる実務力を持つ。,"['体位変換','食事介助','認知症ケア','紙ベースのケア記録','家族への情報共有','柔軟なシフト調整']",自然散策や季節の野菜を育てるガーデニング、家族と一緒に作る手作り料理、静かな環境で聴く邦楽や里歌、短編小説や詩を読む読書が好き。人混みは苦手だが、静かに集中できる趣味で心を落ち着かせる。,"['自然散策','ガーデニング','手作り料理','邦楽・里歌鑑賞','短編小説・詩の読書']",中堅介護福祉士として経験を蓄積しつつ、将来的には資格取得でケアマネジメントの知識を身に付け、地域の多様なニーズに対応できる小規模な在宅支援拠点を立ち上げることを目指す。家庭と仕事のバランスを保ちながら、利用者とその家族の自立を支援したい。,女,25,既婚 (子供あり),中学卒,介護福祉業 中堅,近畿地方,西日本,三重県,日本,20代以下,５０～１００万円未満,75.0,国民生活基礎調査(0003131978)P(所得|年代)×全国家計構造調査(0003426512)県別所得指数 で年代×地域条件付け,low,切り詰め,高,PB志向,低,たまに,低,EC・ドラッグストア・郊外量販(車),SNS・動画中心(ネット>テレビ),三重の介護施設で働きながら子どもと夫の三人で暮らしている。二十五歳で収入はとても少なく、毎月節約しながらやっている。生活用品は通販と量販店で価格を比べて買う。プライベートブランドを中心に選んでいるが、実際に手に取って確かめたい気持ちが強くてネットで注文することはそれほど多くない。ガーデニングで季節の野菜を育てていて小さな収穫が毎回うれしい。家族で作る手料理の時間と静かに邦楽を聴く時間は、仕事の疲れをほぐすのに一番効く。詩や短編小説を読む習慣も続けていて、人混みより静かな場所が合っている。
12e520a151f948c3b257d63abc49655a,西山 らなは、農協で培った生産計画と灌漑設計のノウハウを、地域の後継者育成プログラムのカリキュラムに落とし込み、構造的かつ予測可能な学習プロセスを提供するビジネスリーダーである。,西山 らなは、畑の収穫体験で鍛えた体幹と、祭りの太鼓練習で培ったリズム感を組み合わせ、地域のシニア向け農業マラソンと田植えリレートレーニングを企画するスポーツコーディネーターである。,西山 らなは、茶道稽古と季節の花素材を用いた生け花が示す繊細さを、郷土料理の盛り付け演舞に昇華させ、祭礼の演出チームで創造的なビジュアル表現を指導する芸術指導者である。,西山 らなは、寺社巡礼と歴史散策で得た地域知識と、農協での協働経験を活かし、シニア向けの食文化体験ツアーと、季節行事参加型のローカル・エコツアーを企画運営する旅行プランナーである。,西山 らなは、古くから続く郷土料理の保存と、茶道の懐石精神を融合させ、季節ごとの野菜収穫と調理体験を融合した料理教室『農と茶の季節食堂』を主宰する料理文化伝承者である。,西山 らなは、協働と忠誠を礎に、計画性と安全志向で地域農業・文化活性化に貢献する、高齢シニアのマルチ分野リーダーである。,愛知県の農業が盛んな地域で、戦後の農協の拡大期に育ち、生活の大部分を長年にわたる農協の終身雇用体制の中で過ごしてきました。地域の祭りや、共同作業を通じて培われた『協働と忠誠』という価値観が、人生観や人間関係の基盤となっています。また、古くから続く郷土料理や茶道の習慣にも親しみ、地元の歴史や風土への敬意を持ち続けています。,農協での長期勤務を通じ、作物の育成管理や灌漑システムの設計、季節ごとの生産計画立案に精通しています。農機具のメンテナンスやフィールドでの手書きによる帳簿管理、地域の農家との調整・交渉、作業安全衛生の指導など、現場主導の実務スキルを有しています。加えて、季節ごとの農作業スケジュール策定や、農作物の品質管理・出荷手順の標準化にも経験があります。,"[""作物育成のノウハウ"",""灌漑システム設計・保守"",""農機具メンテナンス"",""手書き帳簿での農業記録管理"",""地域農家との調整・交渉"",""安全衛生指導と作業スケジュール策定""]",茶道の稽古や、季節の花々を生ける生け花、また、地元の歴史散策や郷土料理の調理に関心があります。寺社巡礼や、畑での野菜の収穫体験を通じて、自然と触れ合う時間を大切にしています。,"[""茶道"",""生け花"",""歴史散策"",""郷土料理の調理"",""寺社巡礼"",""自家野菜の収穫体験""]",退職後は、培ってきた知見を若手農家や地域の後継者に伝える活動に注力し、農協の歴史的資料の保存・公開に貢献したいと考えています。また、地域の食文化保存や、季節行事の運営に協力し、地元コミュニティの持続的な活性化を支えることを目標としています。,女,66,死別 (子供あり),高専卒,農協 大手 (現在は引退),中部地方,東日本,愛知県,日本,60代,１００～１５０万円未満,125.0,国民生活基礎調査(0003131978)P(所得|年代)×全国家計構造調査(0003426512)県別所得指数 で年代×地域条件付け,low,普通,中,PB志向,高,たまに,低,スーパー・ドラッグストア・地域商店(駅前/徒歩),テレビ・新聞中心(ネット利用は限定的),愛知の農協で長く働いて六十六歳で引退した。夫を先に亡くして今は子どもたちと連絡を取りながら一人で暮らしている。年金と蓄えで余裕はないが普通にやれている。徒歩で駅前のスーパーと地元の商店を使う。プライベートブランドを選ぶことが多いが品を確かめてから決める習慣は変わらない。茶道の稽古は今も続けていて先生のところへ通う日は気持ちが引き締まる。生け花のたびに夫が好きだった花を思い出す。地域の歴史を調べながら寺社を歩くことと畑の収穫体験が、農業に携わった年月を今の暮らしに繋いでいる。
20b7737b31b44a08b61e93f21fcaa561,堂村 裕実子は、労働者派遣業の現場で安全衛生のチェックリストを紙に書き込み、シフト作成を手作業で行う実務担当者として、ルーティンとチーム調整に習熟し、社交的な話し相手として顧客と口頭で情報を共有しつつ、リーダー職への昇格と新人研修カリキュラム作りに向けた実用的なビジョンを描いている。彼らは、期限遵守のプレッシャーに時折苦労しながらも、実務の改善提案を現場の声として持ち寄ることで、組織内の抵抗感を和らげつつ働きやすい環境整備を推進する。,堂村 裕実子は、地域フリーマーケットの搬入搬出作業をチームゲーム感覚で行い、カラオケでの合唱練習をストレッチとリズム運動の一環として取り入れ、実務のシフト調整で培ったタイムマネジメントを街中のウォーキングイベントに応用する中年のスポーツ愛好家である。彼らは、社交的に仲間のエネルギーを吸収しつつ、実用的に体力を維持し、紙のイベントスケジュールと口頭での参加呼びかけで周囲を巻き込む姿勢を継続する。,堂村 裕実子は、カラオケルームでの高得点のマイクパフォーマンスを、仲間への感謝と季節のフリーマーケットの掛け声に合わせた即興アートとして捉え、社内の紙掲示板に手書きのイベント案内を貼り出すことで、地域の伝統的な声掛けと紙のファンシーなデザインを融合させる実務型アーティストである。彼らは、実用性と創造性の間にあるインタラクティブな表現領域を、口頭でのアイデア共有と紙の簡易デザインで体現し、同僚の笑顔と地域の熱狂を呼び起こす。,堂村 裕実子は、毎月の地域フリーマーケットまでの徒歩ルートを『カーミング・トーク・トレイル』と名付け、紙のルートマップに行き先とクーポン情報を書き込んで持ち歩き、地元のカフェでの駅前散策と、周辺の商店街でのクーポン活用をバランスさせた実務志向のローカル旅行者である。彼らは、紙ベースの旅程表と口頭での同行者への情報共有で、地域の隠れた名所と割引の魅力を同時に楽しむことに満足感を見出す。,堂村 裕実子は、週末に紙のレシピメモに季節野菜と安価な鶏肉を組み合わせた『もったいないシチュー』を手書きで書き留め、フリーマーケットで得た割引食材とクーポン活用の自宅調理法を、近所のカラオケ仲間へ昼食として提供する実務的な料理好きである。彼らは、紙に手書きした食材の賞味期限と予算のファイルを管理し、口頭での献立相談と共に、仲間の笑顔と節約の喜びを同時に味わうことを実践している。,堂村 裕実子は、紙ベースの実務管理と地域交流を通じて、もったいない精神と社交性でリーダーシップと節約料理を結びつけた、実用性重視のキャリア志向の簿記兼人間関係構築者である。,関東地方で育ち、家庭では「もったいない精神」を大切にしながら、日常会話に微妙な関東弁の語尾やイントネーションが混ざることがある。,労働者派遣業の現場で安全衛生管理やシフト作成、チーム調整を担当し、顧客対応や基礎的な会計・文書作成にも精通している。デジタルツールの利用は最小限に留め、紙ベースの手続きや口頭での情報共有を重視する。,"['安全衛生管理','チーム調整','シフト作成','顧客対応','基礎会計','文書作成']",社交的な性格を活かし、カラオケや地域のフリマで人と交流するのが好きで、料理やクーポン活用で家計のやりくりを楽しむ。また、散歩でリフレッシュする時間も大切にしている。,"['カラオケ','地域のフリマ','料理','クーポン活用','散歩']",将来的には部署のリーダー職に昇格し、派遣労働者の働きやすい環境整備や新人研修のカリキュラム作りに貢献したいと考えている。,女,44,既婚 (子供あり),中学卒,労働者派遣業 中堅,関東地方,東日本,東京都,日本,40代,１１００～１２００万円未満,1150.0,国民生活基礎調査(0003131978)P(所得|年代)×全国家計構造調査(0003426512)県別所得指数 で年代×地域条件付け,high,普通,低,NB・品質志向,中,たまに,中,スーパー・ドラッグストア・EC併用(駅前),ネット・テレビ併用,東京で労働者派遣の会社の現場を仕切っている。四十四歳、子どもがいて夫との四人暮らしだ。仕事の実績でここまで来たという自負がある。収入は十分あるが生活費の感覚は変えていない。スーパーとドラッグストアを使いながら必要に応じて通販も使う。有名ブランドを選ぶことが多く、価格よりも使い続けてきた信頼感で決めている。料理は得意で時短でも満足できるメニューを組み合わせている。クーポンを活用して損をしない買い方を探すのも楽しみだ。夕方に一人で歩く時間が次の日の段取りを頭の中で整理する時間になっている。
79aa03740e4d4c77b6ef3d0acfdd4c31,村瀬 友華は、宿泊チェーンの経営統括として、地域資源活用と柔軟な現場調整を組み合わせた持続可能な観光モデルを設計し、次世代経営者へのメンターシップで開放性と協調性を発揮し、計画的な財務管理と柔軟な危機対応のバランスを取ることを重視している。,村瀬 友華は、庭園の手入れと季節の散歩を軽いエクササイズと位置付け、柔軟性と外向性を活かした地域のミニマラソンや茶道の長時間座位を交互に行う独自のリズムで、協調的な参加者同士の交流を促進しながら身体的活力を維持している。,村瀬 友華は、書道と生け花の実践で季節の美意識とインスピレーションを追求し、開放性と誠実性をもって地域の子ども向け美術講座を指導し、協調的な創造活動と自己表現のバランスを保ちながら、伝統的な美学と現代的な感性を融合させている。,村瀬 友華は、古民家宿と温泉地を巡る旅で、地域の祭礼や季節の食文化を体験し、外向性と開放性を活かした旅先での交流を重視し、柔軟なスケジュールで歴史的建造物の価値観を学びながら、協調的な観光モデルを構築している。,村瀬 友華は、季節の食材と茶葉を組み合わせた懐石料理のレシピを熟知し、地域の農家と協力して素材の産地直送を実現、開放性と協調性で新メニューの試作会を開催し、誠実性と柔軟性で食文化継承と創造的料理開発を同時に行っている。,村瀬 友華は、柔軟な経営と伝統的実践を融合させた地域志向のリーダーである。,広島県生まれで、戦後の復興期を経験。地域の子ども向け塾や習い事の運営に協賛し、教育と文化継承への関心が深い。家族は四代続く旅館出身で、広島の平和記念活動にも参加している。,大手宿泊チェーンの経営統括として、ホスピタリティ全般、財務計画、組織人材育成、危機管理に熟達。日本式おもてなしと地域資源活用のノウハウを保持し、業務プロセスのマニュアル化と現場の柔軟な調整が得意。,"['ホスピタリティマネジメント', '財務計画・予算策定', '人材育成・研修設計', '危機対応・リスクマネジメント', '地域資源活用・観光振興']",書道と生け花、庭園の手入れ、季節の茶会開催。広島の美術館巡りと、地域の歴史講座で子どもたちと学ぶ時間を大切にしている。旅行では日本国内の古民家宿や温泉地を訪れるのが好き。,"['書道', '生け花', '庭園手入れ', '茶会主催', '美術館巡り', '歴史講座参加', '古民家宿めぐり']",次世代経営者へのメンターシップを拡大し、持続可能な観光モデルを国内外に発信。広島の平和観光と地方創生を結びつけた新事業を立ち上げ、50年以上の事業継続と地域貢献を実現したい。,女,69,既婚 (子供あり),高校卒,宿泊業 大手 経営,中国地方,西日本,広島県,日本,60代,５００～５５０万円未満,525.0,国民生活基礎調査(0003131978)P(所得|年代)×全国家計構造調査(0003426512)県別所得指数 で年代×地域条件付け,mid,普通,中,PB志向,中,たまに,低,スーパー・ドラッグストア・地域商店(車/家族送迎),テレビ・新聞中心(ネット利用は限定的),広島で宿泊業の小さな経営をしながら六十九歳になった。子どもたちは独立していて夫とともに仕事を続けている。商売をやっていると収入の増減に慣れて使い方も落ち着いてくる。買い物は車で家族とスーパーとドラッグストアと地元の商店を回る。プライベートブランドを選ぶことが多くなったのは経費感覚が日常に移ったからだと思う。書道は長く続けていて筆で字を書く時間がないと一週間が締まらない。宿の入口に置く花を自分で生けていて生け花と庭の手入れも続けている。旅行では古民家の宿を選ぶ。泊まり手として宿を見る経験が自分の仕事に直接戻ってくる。
