uuid,professional_persona,sports_persona,arts_persona,travel_persona,culinary_persona,persona,cultural_background,skills_and_expertise,skills_and_expertise_list,hobbies_and_interests,hobbies_and_interests_list,career_goals_and_ambitions,sex,age,marital_status,education_level,occupation,region,area,prefecture,country,age_band,household_income_bracket,household_income_midpoint_manyen,household_income_source,income_tier,disposable_income_feel,price_sensitivity,brand_orientation,promotion_responsiveness,bulk_buy_tendency,ec_adoption,primary_purchase_channels,media_contact,backstory_250w
7cd10483b0064cf391dc79545845c67b,佐藤 大空は、退職後に若手職人への技能指導と地域の鉄鋼技術保存団体で安全文化啓発を推進し、構造的で予測可能な業務プロセスと高い成果基準を組み合わせたリーダーシップを提供する。,佐藤 大空は、庭の芝刈りと軽いストレッチングを週２回のルーティンに取り入れ、構造化された運動計画と規律正しい実行を通じて体力と柔軟性の維持を図っている。,佐藤 大空は、書道と庭園デザインの両面で伝統的な筆遣いと植栽配置を磨き、組織的な創作プロセスと高い誠実性を融合させて地域史の視覚的記録を作り上げている。,佐藤 大空は、かつての鋼鉄工場跡地への散策と地元史館への定期訪問を旅のテーマに据え、予測可能なスケジュール管理と地域連帯感を重視した旅程で歴史的遺産を巡っている。,佐藤 大空は、庭で育てた大根と季節の根菜を使った漬物と、昔ながらの煮込み料理を調理し、規律正しいレシピ遵守と味の一貫性を追求して食事を楽しんでいる。,佐藤 大空は、構造的な思考と規律正しい行動で安全文化と地域遺産の保存に取り組む、74歳の実務家である。,長崎県佐世保市出身で、戦後の高度成長期に鉄鋼産業の中心地に育ち、地元の祭りやカトリック系の共同体行事を通じて地域連帯感と勤勉さを学んだ。,鉄鋼生産ラインのオペレーション管理、品質保証業務、溶接技術、機械保守、チームリーダーシップ、労働安全衛生の知識,"['鉄鋼生産ラインオペレーション管理','品質保証','溶接技術','機械保守','チームリーダーシップ','労働安全衛生']",庭いもの栽培や書道、地元の歴史研究、散歩、古典テレビ鑑賞を楽しむ。,"['庭いもの栽培','書道','地元歴史研究','散歩','古典テレビ鑑賞']",退職後は若手職人への技能指導や、地域の鉄鋼技術保存団体での活動を通じて産業遺産の継承と安全文化の啓発に努める。,男,74,死別 (子供あり),高校卒,鉄鋼業 大手,九州地方,西日本,長崎県,日本,70代,４００～４５０万円未満,425.0,国民生活基礎調査(0003131978)P(所得|年代)×全国家計構造調査(0003426512)県別所得指数 で年代×地域条件付け,mid,普通,中,NB・品質志向,高,たまに,低,スーパー・ドラッグストア・地域商店(車/家族送迎),テレビ・新聞中心(ネット利用は限定的),妻を亡くしてから三年が過ぎた。週末に息子夫婦が車で来てくれたとき、スーパーへ連れて行ってもらう。テレビと新聞があれば世の中のことはだいたいわかるから、ネットはとくに要らない。鉄鋼の現場で四十年以上働いて、安全への感覚が骨の髄まで染みた。今は庭の野菜と書道が日課だ。肥料の銘柄だけは変えない。長年使ってきた国産のものが体に合っているとわかっているから、値段が多少高くても安物に替えるつもりはない。年金で十分やっていける。地元の史跡研究会にも顔を出す。長崎には埋もれた歴史が多い。
a09ace4121cc443ab13a66585b9b839a,菅原 泰史は郵便配達のデジタル最適化エキスパートとして、GISマッピングと高度Excel活用に基づく業務効率化を推進し、予測可能なプロセス設計を重視する。彼らは構造志向と責任感を組み合わせ、若手デジタル人材の指導において競争的な目標設定と批判的分析を提供する。,菅原 泰史は週末に地元の公園で軽いジョギングとストレッチを行い、過度な競争心を抑えたペースで体力維持を目指す。彼らは計画的なトレーニングスケジュールと、予測不能な天候変化に対する柔軟なスケジューリングで、構造的な運動ルーティンを支える。,菅原 泰史は折り紙と古典文学の読書を通じて、細部への注意と歴史的価値観への敬意を表現し、写真撮影で身近な風景をアーカイブする芸術的観点を持つ。彼らは創造的なアウトプットを自己批判的に評価し、陰鬱な感情の波を作品のテーマとして具象化する。,菅原 泰史は川辺散歩と地域清掃のボランティア活動を通じて、近隣の自然と人間関係を観察し、写真で記録するローカル・エクスプローラーである。彼らは予測可能なルート計画と、偶然の風景発見をバランスさせ、日常の移動に意味付けを行う。,菅原 泰史は季節の野菜と手作り昆布だしを用いたシンプルな和食を好み、折り紙の折り方と同様に食材の配置とバランスにこだわる。彼らは料理をデジタルレシピ管理で体系化し、感情の変動が大きいときの安定感を食事に求める。,菅原 泰史はデジタル最適化と地域サービス精神を組み合わせ、構造的評価と感情波の自己管理で成果を最大化する。,関東・埼玉県出身で、バブル期からの労働観と情報化の波を経験し、世代間ギャップを意識しながら地域のつながりとサービス精神を大切にしています。,郵便ルート最適化システムの運用とデジタルデータベース管理に長け、GISマッピングや高度なExcel活用で業務効率化を推進し、Pythonでの簡易スクリプト作成にも熟練しています。,"['スキャンシステム運用','データベース管理','GISマッピング','Excel高度活用','Pythonスクリプト作成']",折り紙や古典文学の読書、川辺散歩といった静かな活動を好みつつ、地域清掃ボランティアでサービス精神を発揮し、写真で身近な風景を記録することに興味があります。,"['折り紙','川辺散歩','古典文学読書','地域清掃ボランティア','写真']",デジタル化をさらに進めて配送精度を向上させ、若手デジタル人材の指導に貢献し、将来的には顧客サービス向上のコンサルタント的役割へ移行したいと考えています。,男,59,未婚,大学卒 文系,郵便業 中堅,関東地方,東日本,埼玉県,日本,50代,５０～１００万円未満,75.0,国民生活基礎調査(0003131978)P(所得|年代)×全国家計構造調査(0003426512)県別所得指数 で年代×地域条件付け,low,切り詰め,高,NB・品質志向,低,たまに,高,スーパー・ドラッグストア・EC併用(駅前),ネット・テレビ併用,収入は少ない部類に入るとわかっている。郵便の現場で働きながら毎月の支出を精密に管理することが習慣になった。食料品はスーパーと通販を使い分けて安い選択肢を探す。ただ、本だけは別だ。古典文学の文庫を選ぶとき、版元と校注者を確認する。粗悪な復刻版には手を出さない。折り紙も続けているが、紙の質にこだわる。安い紙では細かい折りが決まらない。川べりを朝に歩くのは金のかからない楽しみで、仕事帰りにカメラを構えながら駅から歩いて帰るのが今の一番の時間だ。埼玉で一人暮らしを続けて三十年以上になる。
60b7543faa0a430e8e4c844690b2660d,村松 洋之は、運輸業で培った車両点検・配車最適化のノウハウを活かし、引退後は地域の若者向けに実務中心の物流安全講座を開催し、地域交通安全キャンペーンの企画ボランティアとして、組織的計画と実用性への高い開放性を持って、同時に競争的な視点で安全基準の遵守を徹底している。,村松 洋之は、週に数回の川辺釣りと、春夏の庭の散策を競技的に時間管理し、効率化されたルート計画の思考をフィジカル活動に転用し、外向性の低さが少人数での釣り仲間との競争的スコア記録を好み、神経症が高いが、体系的なストレッチと安全装備のチェックリストでリスクを最小化している。,村松 洋之は、和紙で手紙を書く手作業と、季節花のレイアウトを通じて、地域の祭り用の装飾提案を企画し、開放性が高く新素材の試行を好む一方で、誠実性が高く伝統的な書道と現代的なデジタル記録を組み合わせ、外向性の低さが小規模のアートワークショップでの深い対話を促し、神経症的な自己批評を創作の品質向上に活かす。,村松 洋之は、春の桜名所への日帰り列車旅行と、秋の収穫祭参加の短期旅程を計画し、配車記録の効率化経験を旅程管理に応用し、外向性が低いため少人数の旅行仲間と事前に詳細なスケジュールと安全チェックリストを共有し、開放性が高く地域の方言ガイドブックを自作して文化的実践を深めている。,村松 洋之は、庭で収穫した季節野菜と川で釣った鮎を使い、伝統的な味噌漬けと炭火焼きを組み合わせた家庭料理を定期的に提供し、誠実性が高くレシピの紙記録と簡易PCでの栄養計算を管理し、外向性の低さが少人数の食事会での丁寧なサーブと、神経症的な味の微調整を通じて、食材の持つ地域価値と季節感を重視する。,村松 洋之は、物流安全の実務知識を地域教育に転用し、祭りと庭仕事で文化実践を継ぎ、競争的計画とストレス管理で高い誠実性と神経症的注意を保つ。,兵庫県出身で、戦後の高度経済成長期を経験し、地域の祭りや方言に誇りを持つ。学歴への関心が高く、地元志向が強い。,運輸業で培った車両点検・整備、長距離ルートの配車計画と効率化、紙ベースと簡易PCでの配送記録管理、物流安全基準の遵守、地域交通インフラに関する助言。,"[""車両点検・整備"",""配車計画・ルート最適化"",""紙ベースと簡易PCでの配送記録管理"",""物流安全基準の遵守"",""地域交通インフラに関する助言""]",小規模の歴史講座への参加、庭で季節の花を育てるガーデニング、和紙を使った手紙書き、川辺での釣り、地域の祭りの企画ボランティア。,"[""歴史講座参加"",""ガーデニング"",""和紙手紙書き"",""釣り"",""祭り企画ボランティア""]",引退後は地元の若者に物流の実務と安全意識を教える講座を開催し、地域の交通安全キャンペーンに協力して、長年の経験を活かして地元の交通環境改善に貢献したい。,男,74,既婚 (子供あり),高校卒,運輸業 中堅 (現在は引退),近畿地方,西日本,兵庫県,日本,70代,１５０～２００万円未満,175.0,国民生活基礎調査(0003131978)P(所得|年代)×全国家計構造調査(0003426512)県別所得指数 で年代×地域条件付け,low,普通,高,PB志向,高,よくする,中,スーパー・ドラッグストア・地域商店(駅前/徒歩),テレビ・新聞中心(ネット利用は限定的),引退してから徒歩で買い物できる範囲で生活するようになった。運輸の仕事で長距離を走り続けた体は無理がきかない。妻と二人でスーパーと地元の商店を組み合わせ、プライベートブランドを中心に献立を組む。収入は少ないが、やりくりの仕方は体に染みついている。庭の花だけはこだわる。春の苗は多少値が張っても専門店を選ぶ。プランターに並んだときの密度が全然違う。地域の祭りの実行委員を続けているのは、物流の段取りを組む感覚が祭りの準備に似ていると気づいたからだ。川魚の釣りと和紙の手紙書きが、退職後に増えた静かな時間の使い方だ。
7fe8acb2e9bd4504a84404236676963a,鈴木 昌広はゴム射出成形の設備保全リーダーを目指し、オープンなアイデア共有と柔軟なスケジュール調整を重視しつつ、競争的に不良削減実績を活かした持続可能な材料導入プロジェクトの主導を志す。,鈴木 昌広はプラモデル組み立てのような細部への集中力を活かし、都市部のジョギングと週末のジムでの筋力トレーニングを競争的に行い、外向性で得た仲間とのランニングシェアでモチベーションを保っている。,鈴木 昌広は抽象画の鑑賞と自作、フィルムカメラによる街撮影、ジャズライブへの参席を通じて、想像力豊かなビジュアルとサウンドの融合を探求し、創造的なデザインと環境配慮を結びつけるアートプロジェクトを企画している。,鈴木 昌広は即興の街歩きとフィルム撮影を旅のスタイルとし、都市のカフェで地元住民と対話しながら、柔軟な日程と予算調整で週末のミニ旅行を計画し、経験からインスピレーションを得ている。,鈴木 昌広は季節野菜と自家製発酵調味料を使った和風パスタ、ジャズライブ後の深夜にインスピレーションを受けて即興で作るデザート、素材の味を尊重する料理実験を楽しんでいる。,鈴木 昌広は創造的な技術と柔軟な社交性を活かし、リーダーシップと持続可能性を追求する多面的なプロフェッショナルである。,神奈川郡出身で、幼少期は母親が大学進学を目指すほど教育熱心に育てた環境にあった。現在は、高齢の父親の介護を週に数回手伝う生活を送っている。,ゴム製品の射出成形工程の設備保全と品質管理に長年従事し、工程標準化と不良削減の実績がある。Excelと社内ERPでの生産データ分析、機械加工の基礎知識も有する。,"['射出成形設備保全','品質管理','工程標準化','Excelデータ分析','ERP操作','機械加工基礎']",抽象画の鑑賞と自作、フィルムカメラでの街撮影、ジャズライブへ足を運ぶこと、プラモデルの組み立てなど、芸術的かつ手作業を伴う趣味に没頭している。,"['抽象画鑑賞・制作','フィルムカメラ撮影','ジャズライブ','プラモデル組み立て']",生産ラインのリード担当へ昇格し、持続可能なゴム材料の導入プロジェクトを主導したい。将来的には、創造的なデザインと環境配慮を融合させた小規模メーカーを設立する野望がある。,男,40,未婚,高専卒,ゴム製品製造業 中堅,関東地方,東日本,神奈川県,日本,40代,４５０～５００万円未満,475.0,国民生活基礎調査(0003131978)P(所得|年代)×全国家計構造調査(0003426512)県別所得指数 で年代×地域条件付け,mid,切り詰め,高,PB-NB併用,高,たまに,中,スーパー・ドラッグストア・EC併用(駅前),ネット・テレビ併用,ゴム製品の製造ラインで十数年、神奈川で独り暮らしを続けている。手取りが多くない割に固定費がかさむから、食費と日用品は通販と駅前のスーパーで抑える。プライベートブランドと有名メーカーを品目ごとに使い分けるが、感覚でなくスペックを見て決める。ところが趣味の方は違う。フィルムカメラと現像代は削らない。デジタルの方が早くて安いとわかっていても、銀塩の質感のために金をかける気になれる。ジャズのライブにも月一回は行く。値段を理由に断ったことがない。この出費が生活にあることで、他の節約が苦にならない。
51c065c1b62749b79f3db1dd56d1948d,畠山 奈々子は、看護部のリーダーシップ研修を視野に入れたキャリア設計を、段取りのよいシフト計画とチーム調整の実務で具体化し、組織的な品質向上プロジェクトを構造化されたロードマップで先導しようとする姿勢を示すビジネスパーソンである。彼らは、約束したことは必ず実行し、協調的ながら必要に応じて断固とした判断を下すことができる。,畠山 奈々子は、季節の散歩を通じて海岸線や山道の自然リズムを体感し、軽いジョギングと手作りの編み物ストレッチを組み合わせた独自のフィットネスルーティンを実践するスポーツ愛好者である。彼らは、外向性は程よく社交的でありつつも、計画的にトレーニングメニューを組み立て、自己管理の徹底を重んじる。,畠山 奈々子は、ミステリー小説の読書と季節素材を活かした料理創作、手編みの作品という三位一体の芸術活動に没頭し、伝統的な手仕事と現代的な創作の橋渡しを行うアーティストである。彼らは、開放性の高い想像力を持ちながら、作品の完成度を計画的に追求し、協調的に作品展開を行う。,畠山 奈々子は、海産物が豊かな漁港や季節ごとの山岳道への短期旅行を好み、地元の祭りやボランティア活動を通じて地域の価値観を体感しながら、計画的な旅程で新たな風景を探索する旅行者である。彼らは、外向的に現地の人々と交流しつつ、旅行の目的と安全を詳細にマッピングする姿勢を持つ。,畠山 奈々子は、北海道の旬の海産物と野菜を活かした料理を、季節感を大切にしながらレシピをデータ化し、調理過程の効率と味の品質を最適化する料理人である。彼らは、誠実に材料の産地と調理時間を管理し、感受性の高い味覚評価と共に、計画的に食事プランを構築する。,畠山 奈々子は、組織的で計画性の高い看護師として品質改善と地域医療貢献を志向し、季節感を重視した料理と手芸、データ分析を活かした財務管理と自然散歩を通じて、協調性とストレス耐性のバランスを保ちつつ自己成長を図る人物である。,北海道出身で、地元の季節感や海産物に対する誇りが強い。日常会話では、やや柔らかい方言のアクセントが混ざり、地域の人とのコミュニケーションが自然に取れる。,患者の全般的なケアと点滴・注射などの静脈管理が得意で、電子カルテを用いた情報記録と、品質改善のための基礎的なデータ分析を行う。シフト計画やチーム内の調整も担当し、医師や他職種との円滑な連携を意識した実務を遂行している。,"[""患者ケア"",""点滴管理"",""電子カルテ操作"",""品質改善データ分析"",""シフト計画""]",地元産の食材を活かした料理や、季節ごとの散歩、家族と一緒に楽しむ手芸や編み物に没頭する。休日にはミステリー小説を読んでリフレッシュし、地域ボランティア活動にも参加している。,"[""料理（北海道食材）"",""散歩"",""編み物・手芸"",""ミステリー小説読書"",""地域ボランティア""]",数年以内に看護部のリーダーシップ研修を修了し、病棟の品質向上プロジェクトを主導する役割を担うことが目標。将来的には、看護師長としてチームを統率し、地域医療の発展に貢献したいと考えている。,女,29,既婚 (子供あり),高校卒,病院 中堅,北海道地方,東日本,北海道,日本,20代以下,３５０～４００万円未満,375.0,国民生活基礎調査(0003131978)P(所得|年代)×全国家計構造調査(0003426512)県別所得指数 で年代×地域条件付け,mid,普通,低,PB-NB併用,中,しない,高,EC・ドラッグストア・郊外量販(車),SNS・動画中心(ネット>テレビ),北海道で病院に勤めながら、二十代で結婚して子どもが生まれた。シフトが不規則だから、買い物はほとんど通販とドラッグストアで済ませる。郊外の量販店へ車でまとめて行くこともある。価格より品質と手軽さを優先することが多い。SNSで口コミを確認してから注文する習慣があって、プライベートブランドも有名ブランドも使って良かったものを繰り返す。こだわりは食材で、地元産を使った料理に力を入れている。旬の野菜を選ぶのが好きで、週末は子どもと一緒に台所に立つ。手芸も細々と続けていて、忙しいなりに暮らしの充実感がある。
